"nucl-th/9304005","Peter Henning","P.A.Henning and H.Umezawa","The Delta-Hole model at Finite Temperature","34 pages in standard LaTeX GSI-preprint No. GSI-93-23","Nucl.Phys. A571 (1994) 617-644","10.1016/0375-9474(94)90713-7",,"nucl-th",,"  The spectral function of pions interacting with a gas of nucleons and
Delta-33-resonances is investigated using the formalism of Thermo Field
Dynamics. After a discussion of the zero Delta-width approximation at finite
temperature, we take into account a constant width of the resonance. Apart from
a full numerical calculation, we give analytical approximations to the pionic
spectral function including such a width. They are found to be different from
previous approximations, and require an increase of the effective Delta-width
in hot compressed nuclear matter. The results are summarized in an effective
dispersion relation for interacting pions.
","[{""version"":""v1"",""created"":""Thu, 8 Apr 1993 10:33:58 GMT""}]","2009-10-22"
"nucl-th/9304006","Peter Henning","P.A.Henning and H.Umezawa","Diagonalization of full finite temperature Green's function by
  quasi-particles","9 pages in standard LaTeX","Phys.Lett. B303 (1993) 209-214","10.1016/0370-2693(93)91421-I",,"nucl-th",,"  For thermal systems, standard perturbation theory breaks down because of the
absence of stable, observable asymptotic states. We show, how the introduction
of {\it statistical} quasi-particles (stable, but not observable) gives rise to
a consistent description. Statistical and spectral information can be cleanly
separated also for interacting systems.
","[{""version"":""v1"",""created"":""Thu, 8 Apr 1993 11:07:42 GMT""}]","2009-10-22"
