"hep-th/9304066",,"D. Bailin, A. Love and W.A. Sabra","Yukawa Couplings involving Excited Twisted Sector States for ${\bf
  Z}_M\times {\bf Z}_N$ Orbifolds","15 pages, SUSX--TH--93/11","Phys.Lett.B311:110-116,1993","10.1016/0370-2693(93)90542-P",,"hep-th",,"  A study is made for ${\bf Z}_M\times {\bf Z}_N$ orbifolds of the modification
of the form of the twisted sector Yukawa couplings when some of the states
involved are excited twisted sectors rather than twisted sector ground states.
","[{""version"":""v1"",""created"":""Fri, 16 Apr 1993 15:00:00 GMT""},{""version"":""v2"",""created"":""Fri, 7 May 1993 14:20:00 GMT""}]","2010-11-01"
"nucl-th/9304011","Herbert Muether","L.D. Skouras, H. M\""uther, M.A. Nagarajan","Determination of Dipole Polarization Effects in $^7$Li and $^{11}$Li","26 pages LaTeX, 8 figures","Nucl.Phys. A561 (1993) 157-180","10.1016/0375-9474(93)90148-Q",,"nucl-th",,"  The structure of $^6$Li, $^7$Li and $^{11}$Li nuclei is investigated in a
model space which includes all configurations with oscillator energy up to
$3\hbar\omega$ above the ground state configuration. The energy spectra and
electromagnetic properties of the low-lying states are determined with various
two-body interactions, which are derived from the Bonn potential. The results
of these shell-model calculations depend on the strength of the tensor
component contained in the NN interaction and also on the treatment of the
Dirac spinors for the nucleons in the nuclear medium. In addition the
calculation determines the {\it dipole polarizability} of $^7$Li and $^{11}$Li
caused from virtual $E1$ excitations to the positive parity states of these
nuclei. It is demonstrated that the BAGEL scheme provides a very powerful tool
to consider contributions from virtual excitations up to large energies.
","[{""version"":""v1"",""created"":""Thu, 15 Apr 1993 17:05:25 GMT""}]","2009-10-22"
"nucl-th/9304012",,"W. A. Beck, L. Wilets and M. A. Alberg","Semi-Classical Description of Antiproton Capture on Atomic Helium","15 pages, 9 figures may be obtained from authors, Revtex",,"10.1103/PhysRevA.48.2779",,"nucl-th",,"  A semi-classical, many-body atomic model incorporating a momentum-dependent
Heisenberg core to stabilize atomic electrons is used to study antiproton
capture on Helium. Details of the antiproton collisions leading to eventual
capture are presented, including the energy and angular momentum states of
incident antiprotons which result in capture via single or double electron
ionization, i.e. into [He$^{++}\,\bar p$ or He$^{+}\,\bar p$], and the
distribution of energy and angular momentum states following the Auger cascade.
These final states are discussed in light of recently reported, anomalously
long-lived antiproton states observed in liquid He.
","[{""version"":""v1"",""created"":""Thu, 15 Apr 1993 22:24:00 GMT""}]","2009-10-22"
"solv-int/9304001","Jarmo Hietarinta","Kenji Kajiwara (Department of Applied Physics, Faculty of Engineering,
  University of Tokyo, 7-3-1 Hongo, Bunkyo-ku, Tokyo 113, Japan) Yasuhiro Ohta
  (Research Institute for Mathematical Sciences, Kyoto University, Kyoto 606,
  Japan) Junkichi Satsuma (Department of Mathematical Sciences, University of
  Tokyo, 3-8-1 Komaba, Meguro-ku, Tokyo 153, Japan)","q-Discrete Toda Molecule Equation","12 pages in plain tex",,"10.1016/0375-9601(93)90705-5",,"solv-int hep-th nlin.SI",,"  A q-discrete version of the two-dimensional Toda molecule equation is
proposed through the direct method. Its solution, B\""acklund transformation and
Lax pair are discussed. The reduction to the q-discrete cylindrical Toda
molecule equation is also discussed.
","[{""version"":""v1"",""created"":""Fri, 16 Apr 1993 06:56:31 GMT""}]","2009-10-22"
