"astro-ph/9304016","Tsvi Piran","Shude Mao, Ramesh Narayan and Tsvi Piran","On the Bimodal Distribution of Gamma-Ray Bursts","14 pages, LaTeX, figures not included. For figures please contact
  smao@cfa.harvard.edu",,"10.1086/173550",,"astro-ph",,"  Kouveliotou et al. (1993) recently confirmed that gamma-ray bursts are
bimodal in duration. In this paper we compute the statistical properties of the
short ($\le 2$~s) and long ($>2$~s) bursts using a method of analysis that
makes no assumption regarding the location of the bursts, whether in the Galaxy
or at a cosmological distance. We find the 64 ms channel on BATSE to be more
sensitive to short bursts and the 1024 ms channel is more sensitive to long
bursts. We show that all the currently available data are consistent with the
simple hypothesis that both short and long bursts have the same spatial
distribution and that within each population the sources are standard candles.
The rate of short bursts is $\sim 0.4$ of the rate of long bursts. Although the
durations of short and long gamma-ray bursts span several orders of magnitude
and the total energy of a typical short burst is smaller than that of a typical
long burst by a factor of $\sim 20$, surprisingly the peak luminosities of the
two kinds of bursts are equal to within a factor of $\sim 2$.
","[{""version"":""v1"",""created"":""Fri, 16 Apr 1993 15:02:55 GMT""}]","2009-10-22"
"chao-dyn/9304006",,"G. Cicogna and L. Fronzoni (Pisa, Italy)","Modifying the onset of homoclinic chaos. Application to a bistable
  potential","plain Tex",,"10.1103/PhysRevE.47.4585",,"chao-dyn nlin.CD",,"  We analyze, by means of Melnikov method, the possibility of modifying the
threshold of homoclinic chaos in general 1-dimensional problems, by introducing
small periodic resonant modulations. We indicate in particular a prescription
in order to increase the threshold (i.e. to prevent chaos), and consider then
its application to the bistable Duffing-Holmes potential. All results are
confirmed both by numerical and by analog simulations, showing that small
modulations can in fact sensibly influence the onset of chaos.
","[{""version"":""v1"",""created"":""Fri, 16 Apr 1993 10:41:30 GMT""}]","2009-10-22"
"chao-dyn/9304007","Petr Kurka","Petr Kurka (Charles University, Prague)","One-dimensional dynamics and factors of finite automata","Latex, 15 pages",,,,"chao-dyn nlin.CD",,"  We argue that simple dynamical systems are factors of finite automata,
regarded as dynamical systems on discontinuum. We show that any homeomorphism
of the real interval is of this class. An orientation preserving homeomorphism
of the circle is a factor of a finite automaton iff its rotation number is
rational. Any $S$-unimodal system on the real interval, whose kneading sequence
is either periodic odd or preperiodic, is also a factor of a finite automaton,
while $S$-unimodal systems at limits of period doubling bifurcations are not.
","[{""version"":""v1"",""created"":""Fri, 16 Apr 1993 13:34:54 GMT""}]","2008-02-03"
"cond-mat/9304024","Craig Tracy","Estelle L. Basor and Craig A. Tracy","Variance Calculations and the Bessel Kernel","7 pages; resubmitted to make postscript compatible","J. Stat. Phys. 73 (1993) 415-421","10.1007/BF01052770",,"cond-mat hep-th math-ph math.MP nlin.SI solv-int",,"  In the Laguerre ensemble of N x N (positive) hermitian matrices, it is of
interest both theoretically and for applications to quantum transport problems
to compute the variance of a linear statistic, denoted var_N f, as N->infinity.
Furthermore, this statistic often contains an additional parameter alpha for
which the limit alpha->infinity is most interesting and most difficult to
compute numerically. We derive exact expressions for both lim_{N->infinity}
var_N f and lim_{alpha->infinity}lim_{N->infinity} var_N f.
","[{""version"":""v1"",""created"":""Fri, 16 Apr 1993 06:21:14 GMT""},{""version"":""v2"",""created"":""Tue, 2 Feb 1999 03:35:32 GMT""}]","2009-07-11"
"cond-mat/9304025","Andrea Crisanti","A. Crisanti, G. Paladin, M. Serva, A. Vulpiani","Lack of self-average in weakly disordered one dimensional systems","17 pages + 5 figures, TeX dialect: Plain TeX + IOP macros (included)",,"10.1051/jp1:1993227","TNT 93-2","cond-mat",,"  We introduce a one dimensional disordered Ising model which at zero
temperature is characterized by a non-trivial, non-self-averaging, overlap
probability distribution when the impurity concentration vanishes in the
thermodynamic limit. The form of the distribution can be calculated
analytically for any realization of disorder. For non-zero impurity
concentration the distribution becomes a self-averaging delta function centered
on a value which can be estimated by the product of appropriate transfer
matrices.
","[{""version"":""v1"",""created"":""Fri, 16 Apr 1993 06:59:54 GMT""}]","2009-10-22"
"cond-mat/9304026","Andrea Crisanti","A. Crisanti, M falcioni, A. Vulpiani","Transition from regular to complex behaviour in a discrete deterministic
  asymmetric neural network model","18 pages + 6 figures, TeX dialect: Plain TeX + IOP macros (included)","J.Phys. A26 (1993) 3441-3454","10.1088/0305-4470/26/14/011","TNT 93-3","cond-mat",,"  We study the long time behaviour of the transient before the collapse on the
periodic attractors of a discrete deterministic asymmetric neural networks
model. The system has a finite number of possible states so it is not possible
to use the term chaos in the usual sense of sensitive dependence on the initial
condition. Nevertheless, at varying the asymmetry parameter, $k$, one observes
a transition from ordered motion (i.e. short transients and short periods on
the attractors) to a ``complex'' temporal behaviour. This transition takes
place for the same value $k_{\rm c}$ at which one has a change for the mean
transient length from a power law in the size of the system ($N$) to an
exponential law in $N$. The ``complex'' behaviour during the transient shows
strong analogies with the chaotic behaviour: decay of temporal correlations,
positive Shannon entropy, non-constant Renyi entropies of different orders.
Moreover the transition is very similar to that one for the intermittent
transition in chaotic systems: scaling law for the Shannon entropy and strong
fluctuations of the ``effective Shannon entropy'' along the transient, for $k >
k_{\rm c}$.
","[{""version"":""v1"",""created"":""Fri, 16 Apr 1993 07:43:08 GMT""}]","2009-10-22"
"cond-mat/9304027","Sylvie Zaffanella","Fran\c{c}ois Ladieu, Jean-Philippe Bouchaud","Conductance statistics in small GaAs:Si wires at low temperatures. I.
  Theoretical analysis: truncated quantum fluctuations in insulating wires",,,"10.1051/jp1:1993247","Saclay-S93/023","cond-mat",,"  We analyse in detail Mott's variable range hopping in one dimension,
expanding on earlier work by Raikh and Ruzin. We show that the large
conductance fluctuations in disordered insulators result from a subtle
interplay between purely quantum phenomena and geometrical fluctuations arising
from the energies and locations of the impurities. Our results compare very
well with both experiments and numerical simulations.
","[{""version"":""v1"",""created"":""Fri, 16 Apr 1993 11:02:00 GMT""}]","2009-10-22"
"cond-mat/9304028","Sylvie Zaffanella","Yshai Avishai, Jean-Louis Pichard, Khandker A. Muttalib","Quantum transmission in disordered insulators: random matrix theory and
  transverse localization","Saclay-S93/025 Email: pichard@amoco.saclay.cea.fr",,"10.1051/jp1:1993249",,"cond-mat",,"  We consider quantum interferences of classically allowed or forbidden
electronic trajectories in disordered dielectrics. Without assuming a directed
path approximation, we represent a strongly disordered elastic scatterer by its
transmission matrix ${\bf t}$. We recall how the eigenvalue distribution of
${\bf t.t}^{\dagger}$ can be obtained from a certain ansatz leading to a
Coulomb gas analogy at a temperature $\beta^{-1}$ which depends on the system
symmetries. We recall the consequences of this random matrix theory for
quasi--$1d$ insulators and we extend our study to microscopic three dimensional
models in the presence of transverse localization. For cubes of size $L$, we
find two regimes for the spectra of ${\bf t.t}^{\dagger}$ as a function of the
localization length $\xi$. For $L / \xi \approx 1 - 5$, the eigenvalue spacing
distribution remains close to the Wigner surmise (eigenvalue repulsion). The
usual orthogonal--unitary cross--over is observed for {\it large} magnetic
field change $\Delta B \approx \Phi_0 /\xi^2$ where $\Phi_0$ denotes the flux
quantum. This field reduces the conductance fluctuations and the average
log--conductance (increase of $\xi$) and induces on a given sample large
magneto--conductance fluctuations of typical magnitude similar to the sample to
sample fluctuations (ergodic behaviour). When $\xi$ is of the order of the
","[{""version"":""v1"",""created"":""Fri, 16 Apr 1993 11:06:00 GMT""}]","2009-10-22"
"cond-mat/9304029","Sylvie Zaffanella","F. Ladieu, D. Mailly, M. Sanquer","Conductance statistics in small insulating GaAs:Si wires at low
  temperature. II. Experimental study","Email contact: sanquer@amoco.saclay.cea.fr",,"10.1051/jp1:1993248","Saclay-S93/024","cond-mat",,"  We have observed reproducible conductance fluctuations at low temperature in
a small GaAs:Si wire driven across the Anderson transition by the application
of a gate voltage. We analyse quantitatively the log-normal conductance
statistics in terms of truncated quantum fluctuations. Quantum fluctuations due
to small changes of the electron energy (controlled by the gate voltage) cannot
develop fully due to identified geometrical fluctuations of the resistor
network describing the hopping through the sample.
  The evolution of the fluctuations versus electron energy and magnetic field
shows that the fluctuations are non-ergodic, except in the critical insulating
region of the Anderson transition, where the localization length is larger than
the distance between Si impurities.
  The mean magnetoconductance is in good accordance with simulations based on
the Forward-Directed-Paths analysis, i.e. it saturates to $ {\rm ln} (\sigma
(H>1)/\sigma (0))\simeq 1, $ as $ \sigma (0) $ decreases over orders of
magnitude in the strongly localized regime.
","[{""version"":""v1"",""created"":""Fri, 16 Apr 1993 15:33:00 GMT""}]","2009-10-22"
"gr-qc/9304019","Piotr T. Chrusciel","Lars Andersson, Piotr T. Chrusciel","On ``hyperboloidal'' Cauchy data for vacuum Einstein equations and
  obstructions to smoothness of ``null infinity''","8 pages, revtex style","Phys.Rev.Lett. 70 (1993) 2829-2832","10.1103/PhysRevLett.70.2829",,"gr-qc",,"  Various works have suggested that the Bondi--Sachs--Penrose decay conditions
on the gravitational field at null infinity are not generally representative of
asymptotically flat space--times. We have made a detailed analysis of the
constraint equations for ``asymptotically hyperboloidal'' initial data and find
that log terms arise generically in asymptotic expansions. These terms are
absent in the corresponding Bondi--Sachs--Penrose expansions, and can be
related to explicit geometric quantities. We have nevertheless shown that there
exists a large class of ``non--generic'' solutions of the constraint equations,
the evolution of which leads to space--times satisfying the
Bondi--Sachs--Penrose smoothness conditions.
","[{""version"":""v1"",""created"":""Thu, 15 Apr 1993 20:19:54 GMT""}]","2009-10-22"
"gr-qc/9304020","Sam Finn","David F. Chernoff, Lee Samuel Finn","Gravitational Radiation, Inspiraling Binaries, and Cosmology","13 pages (plus 1 figure), LaTeX/aasms, NU-GR-4","Astrophys.J. 411 (1993) L5-L8","10.1086/186898",,"gr-qc astro-ph",,"  We show how to measure cosmological parameters using observations of
inspiraling binary neutron star or black hole systems in one or more
gravitational wave detectors. To illustrate, we focus on the case of fixed mass
binary systems observed in a single Laser Interferometer Gravitational-wave
Observatory (LIGO)-like detector. Using realistic detector noise estimates, we
characterize the rate of detections as a function of a threshold
signal-to-noise ratio $\rho_0$, the Hubble constant $H_0$, and the binary
``chirp'' mass. For $\rho_0 = 8$, $H_0 = 100$ km/s/Mpc, and $1.4 \msun$ neutron
star binaries, the sample has a median redshift of $0.22$. Under the same
assumptions but independent of $H_0$, a conservative rate density of coalescing
binaries ($8\times10^{-8}\,{\rm yr}^{-1}\,{\rm Mpc}^{-3}$) implies LIGO will
observe $\sim 50\,{\rm yr}^{-1}$ binary inspiral events. The precision with
which $H_0$ and the deceleration parameter $q_0$ may be determined depends on
the number of observed inspirals. For fixed mass binary systems, $\sim 100$
observations with $\rho_0 = 10$ in the LIGO detector will give $H_0$ to 10\% in
an Einstein-DeSitter cosmology, and 3000 will give $q_0$ to 20\%. For the
conservative rate density of coalescing binaries, 100 detections with $\rho_0 =
10$ will require about 4~yrs.
","[{""version"":""v1"",""created"":""Thu, 15 Apr 1993 20:52:56 GMT""}]","2009-10-22"
"hep-ph/9304255",,"A. Lopez-Fernandez, J. C. Rom\~ao, F. de Campos and J. W. F. Valle","Model Independent Higgs Boson Mass Limits at LEP","FTUV/93-19, 13 pag + 2 figures(not included but available upon
  request), Latex","Phys.Lett.B312:240-246,1993","10.1016/0370-2693(93)90518-M",,"hep-ph",,"  We derive model-independent constraints on Higgs mass and couplings from
associated signals for higher masses, accessible at LEP2. This work is
motivated by the fact that, in many extensions of the standard model, the Higgs
boson can have substantial ""invisible"" decay modes, for example, into light or
massless weakly interacting Goldstone bosons associated to the spontaneous
violation of lepton number below the weak scale.
","[{""version"":""v1"",""created"":""Thu, 15 Apr 1993 17:33:36 GMT""}]","2009-09-17"
"hep-ph/9304257",,"M. Ciuchini, E. Franco, G. Martinelli, L. Reina","The $\Delta S=1$ Effective Hamiltonian Including Next-to-Leading Order
  QCD and QED Corrections","59, LaTeX, ENS 93/11, ROME prep. 92/913, ULB-TH 93/03","Nucl.Phys. B415 (1994) 403-462","10.1016/0550-3213(94)90118-X",,"hep-ph",,"  In this paper we present a calculation of the $\Delta S=1$ effective weak
Hamiltonian including next-to-leading order QCD and QED corrections. At a scale
$\mu$ of the order of few GeV, the Wilson coefficients of the operators are
given in terms of the renormalization group evolution matrix and of the
coefficients computed at a large scale $\sim M_W$. The expression of the
evolution matrix is derived from the two-loop anomalous dimension matrix which
governs the mixing of the relevant current-current and penguin operators,
renormalized in some given regularization scheme. We have computed the
anomalous dimension matrix up to and including order $\alphas^2$ and $\alphae
\alphas$ in two different renormalization schemes, NDR and HV, with consistent
results. We give many details on the calculation of the anomalous dimension
matrix at two loops, on the determination of the Wilson coefficients at the
scale $M_W$ and of their evolution from $M_W$ to $\mu$. We also discuss the
dependence of the Wilson coefficients/operators on the regularization scheme.
","[{""version"":""v1"",""created"":""Thu, 15 Apr 1993 16:31:44 GMT""}]","2009-10-22"
"hep-ph/9304258",,"Markus A. Luty and Raman Sundrum","Quarkonium Decays and Light Quark Masses","8 pages, LBL-33946, UCB-PTH-93/12","Phys.Lett.B312:205-210,1993","10.1016/0370-2693(93)90511-F",,"hep-ph",,"  The $SU(3)$-violating decays $\Phi^{2S} \goto \Phi^{1S} X$, where $X = \pi^0$
or $\eta$ and $\Phi = J/\psi$ or $\Upsilon$ have been recently proposed as a
means of probing the light quark masses beyond leading order in chiral
perturbation theory. We argue that this analysis is incorrect, even in the
heavy quark limit. We show that these decays are governed by an infinite number
of matrix elements which are not suppressed by any small parameter, and which
cannot be computed with our present understanding of QCD. Furthermore, for
sufficiently heavy quarks, we show that the decay amplitudes can be organized
into a twist expansion, and that the contributions considered in the above
proposal are subleading in this expansion. We also explain how these decays
nonetheless give a constraint on the light quark masses valid at {\it leading
order} in the chiral expansion. The decays $\Phi^{1S} \goto \eta\gamma$ and
$\Phi^{2S} \goto \Phi^{1S} \pi\pi$ also have contributions from infinitely many
operators, contrary to claims in the literature.
","[{""version"":""v1"",""created"":""Thu, 15 Apr 1993 19:38:42 GMT""}]","2009-09-15"
"hep-ph/9304259",,"Vittorio Del Duca","Parke-Taylor amplitudes in the multi-Regge kinematics","17 pages","Phys.Rev. D48 (1993) 5133-5139","10.1103/PhysRevD.48.5133",,"hep-ph",,"  The Parke-Taylor multigluon amplitudes are examined in the multi-Regge
kinematics, which assumes strong rapidity ordering of the produced gluons, and
are used to compute the $n$-gluon production cross section and the gluon-gluon
total cross section.
","[{""version"":""v1"",""created"":""Fri, 16 Apr 1993 00:00:00 GMT""}]","2009-10-22"
"hep-ph/9304260","Stamatis Vokos","Stamatis Vokos","Is Geodetic Precession of Massive Neutrinos the solution to the Solar
  Neutrino Problem?","10 pages in revtex, UW-PT-93-04","Class.Quant.Grav.10:L207-L213,1993","10.1088/0264-9381/10/11/003",,"hep-ph gr-qc",,"  We examine a recent suggestion by Milburn that slightly massive electron
neutrinos, produced left-handed at the core of the sun, suffer geodetic
precession adequate to render them right-handed (and therefore sterile) in
sufficient numbers to solve the solar neutrino problem. In that light, we
perform a complete, general-relativistic calculation of the geodetic spin
precession of an ultrarelativistic particle in the Schwartzschild metric. We
conclude that the effect is negligible, in disagreement with Milburn's
analysis.
","[{""version"":""v1"",""created"":""Fri, 16 Apr 1993 06:40:32 GMT""}]","2010-04-06"
"hep-ph/9304261","Andreas Schaefer","I. Balitsky and A. Sch\""afer","Valley Method Versus Instanton-Induced Effective Lagrangean Up to
  $(E/E_{\rm sphaleron})^{8/3}$","46 pages, LaTeX, UFTP 323/1992, and PSU/TH/119","Nucl.Phys. B404 (1993) 639-683","10.1016/0550-3213(93)90593-E",,"hep-ph",,"  We compare the two most popular approaches to the problem of
instanton-antiinstanton interaction at high energies - the valley method and
the effective-Lagrangian approach - and use them to calculate the
next-to-next-to-leading term in the expansion of ``holy grail'' function
determining the cross section with baryon number violation in the Standard
Model.
","[{""version"":""v1"",""created"":""Fri, 16 Apr 1993 12:52:25 GMT""}]","2009-10-22"
"hep-ph/9304262","Santi Peris","Santiago Peris and Eduardo de Rafael","Constituent Quark Couplings and QCD in the Large $N_c$ Limit","9 pages, 4 figs. not included available upon request to PERIS @
  IFAE.ES, plain TeX, preprint No. UAB-FT-310 and CPT-93/P.2883","Phys.Lett.B309:389-393,1993","10.1016/0370-2693(93)90950-M",,"hep-ph",,"  It is shown that in the constituent quark model of Georgi-Manohar, the
dispersion relation that leads to the Adler-Weisberger sum rule for the axial
vector coupling $g_A$ requires a subtraction constant. This fact explains the
discrepancy between the results of different recent estimates of the $1/N_c$
corrections to Weinberg's large $N_c$ result $g_A=1$, where $N_c$ is the number
of QCD colors. We also discuss a possible scenario which shows that $g_A=1$
might not be a necessary consequence of QCD in the large $N_c$ limit.
","[{""version"":""v1"",""created"":""Fri, 16 Apr 1993 10:20:54 GMT""}]","2008-11-26"
"hep-ph/9304263",,"T.G.Rizzo","Constraints on Anomalous Gauge Boson Couplings From $b \to s\gamma$","10 pages, 6 figures(not included), LaTex, ANL-HEP-PR-93-19","Phys.Lett.B315:471-476,1993","10.1016/0370-2693(93)91643-2",,"hep-ph",,"  The recent results of the CLEO Collaboration on both inclusive and exclusive
radiative $B$ decays are combined with those of the UA2 Collaboration on
$W\gamma$ production to highly constrain the anomalous trilinear gauge
couplings of the $W$. The theoretical analysis of the $b \to s\gamma$ process
employs, next-to-leading order operator coefficient evolution as well as QCD
bremsstrahlung and appropriate phase space corrections.
","[{""version"":""v1"",""created"":""Fri, 16 Apr 1993 13:13:27 GMT""}]","2009-09-09"
"hep-th/9304060","Jae-Suk Park","Jae-Suk Park","N=2 Topological Yang-Mills Theory on Compact K\""{a}hler Surfaces","ESENAT-93-01 & YUMS-93-10, 34pages: [Final Version] to appear in
  Comm. Math. Phys","Commun.Math.Phys. 163 (1994) 113-140","10.1007/BF02101737",,"hep-th",,"  We study a topological Yang-Mills theory with $N=2$ fermionic symmetry. Our
formalism is a field theoretical interpretation of the Donaldson polynomial
invariants on compact K\""{a}hler surfaces. We also study an analogous theory on
compact oriented Riemann surfaces and briefly discuss a possible application of
the Witten's non-Abelian localization formula to the problems in the case of
compact K\""{a}hler surfaces.
","[{""version"":""v1"",""created"":""Fri, 16 Apr 1993 01:41:00 GMT""},{""version"":""v2"",""created"":""Sun, 2 May 1993 13:05:00 GMT""},{""version"":""v3"",""created"":""Wed, 22 Sep 1993 21:19:00 GMT""},{""version"":""v4"",""created"":""Mon, 22 Nov 1993 17:14:00 GMT""}]","2009-10-22"
"hep-th/9304061","Jim Stasheff","Jim Stasheff","Closed string field theory, strong homotopy Lie algebras and the operad
  actions of moduli space","23 pages amstex (8 figures NOT included)",,,"UNC-MATH-93/1","hep-th",,"  This is an expanded and updated version of a talk given at the Conference on
Topics in Geometry and Physics at the University of Southern California,
November 6, 1992. It is a survey talk, aimed at mathematicians AND physicists,
which attempts to bring together the topics in the title without assuming much
background in any of them. Closed string field theory leads to a (strong
homotopy) generalization of Lie algebra, which is strongly related to the way
the moduli spaces $\Cal M_{0,N+1}$ fit together as an ``operad''. The latter in
turn plays an important role in the understanding of vertex operator algebras.
","[{""version"":""v1"",""created"":""Thu, 15 Apr 1993 20:07:51 GMT""}]","2007-05-23"
"hep-th/9304062","Mirjam Cvetic","Mirjam Cvetic","Flat World of Dilatonic Domain Walls","11 pgs (+2 figures available upon request), UPR-560-T","Phys.Rev.Lett.71:815-818,1993","10.1103/PhysRevLett.71.815",,"hep-th gr-qc",,"  We study dilatonic domain walls specific to superstring theory.
  Along with the matter fields and metric the dilaton also changes its value in
the wall background. We found supersymmetric (extreme) solutions which in
general interpolate between isolated superstring vacua with non-equal value of
the matter potential; they correspond to the static, planar domain walls with
{\it flat} metric in the string (sigma model) frame.
  We point out similarities between the space-time of dilatonic walls and that
of charged dilatonic black holes. We also comment on non-extreme solutions
corresponding to expanding bubbles.
","[{""version"":""v1"",""created"":""Fri, 16 Apr 1993 02:31:32 GMT""}]","2009-09-17"
"hep-th/9304063","Craig Tracy","Craig A. Tracy and Harold Widom","Level-Spacing Distributions and the Bessel Kernel","18 pages, resubmitted to make postscript compatible, no changes to
  manuscript content","Commun.Math.Phys. 161 (1994) 289-310","10.1007/BF02099779",,"hep-th math-ph math.MP nlin.SI solv-int",,"  The level spacing distributions which arise when one rescales the Laguerre or
Jacobi ensembles of hermitian matrices is studied. These distributions are
expressible in terms of a Fredholm determinant of an integral operator whose
kernel is expressible in terms of Bessel functions of order $\alpha$. We derive
a system of partial differential equations associated with the logarithmic
derivative of this Fredholm determinant when the underlying domain is a union
of intervals. In the case of a single interval this Fredholm determinant is a
Painleve tau function.
","[{""version"":""v1"",""created"":""Fri, 16 Apr 1993 06:02:51 GMT""},{""version"":""v2"",""created"":""Fri, 29 Jan 1999 23:00:56 GMT""}]","2009-07-11"
"hep-th/9304065","Ed Corrigan","E. Corrigan, P.E. Dorey, R. Sasaki","On a generalised bootstrap principle","23 pages including two figures, harvmac","Nucl.Phys. B408 (1993) 579-599","10.1016/0550-3213(93)90381-X","DTP-93/19 YITP/U-93-09","hep-th",,"  The S-matrices for non-simply-laced affine Toda field theories are considered
in the context of a generalised bootstrap principle. The S-matrices, and in
particular their poles, depend on a parameter whose range lies between the
Coxeter numbers of dual pairs of the corresponding non-simply-laced algebras.
It is proposed that only odd order poles in the physical strip with positive
coefficients throughout this range should participate in the bootstrap. All
other singularities have an explanation in principle in terms of a generalised
Coleman-Thun mechanism. Besides the S-matrices introduced by Delius, Grisaru
and Zanon, the missing case ($f_4^{(1)},e_6^{(2)}$), is also considered and
provides many interesting examples of pole generation.
","[{""version"":""v1"",""created"":""Fri, 16 Apr 1993 09:06:41 GMT""}]","2009-10-22"
