"alg-geom/9311011","Viacheslav V. Nikulin","Viacheslav V. Nikulin","On the Brauer Group of Real Algebraic Surfaces","25 pages, Ams-Tex Version 2.1",,,,"alg-geom math.AG",,"  Let X be a real projective algebraic manifold, s numerates connected
components of X(R) and _2Br(X) the subgroup of elements of order 2 of the
cohomological Brauer group Br(X). We study the natural homomorphism \xi :
_2Br(X) \to (Z/2)^s and prove that \xi is epimorphic if H^3(X(C)/G;Z/2) \to
H^3(X(R);Z/2) is injective. Here G=Gal(C/R). For an algebraic surface X with
H^3(X(C)/G;Z/2)=0 and X(R)\not=\emptyset, we give a formula for dim _2Br(X). As
a corollary, for a real Enriques surfaces Y, the \xi is epimorphic and dim
_2Br(Y)=2s-1 if both liftings of the antiholomorphic involution of Y to the
universal covering K3- surface X have non-empty sets of real points (this is
the general case). For this case, we also give a formula for the number s_{nor}
of non-orientable components of Y which is very important for the topological
classification of real Enriques surfaces.
","[{""version"":""v1"",""created"":""Sun, 28 Nov 1993 16:11:50 GMT""}]","2008-02-03"
"alg-geom/9311012","Viacheslav V. Nikulin","Viacheslav V. Nikulin","On the Topological Classification of Real Enriques Surfaces. I","15 pages, Ams-Tex Version 2.1",,,,"alg-geom math.AG",,"  This note contains preliminary calculation of topological types or real
Enriques surfaces. We realize 59 topological types of real Enriques surfaces
(Theorem 6) and show that all other topological types belong to the list of 21
topological types (Theorem 7). In fact, our calculation contains much more
information which is probably useful to constract or prohibit unknown
topological types.
","[{""version"":""v1"",""created"":""Sun, 28 Nov 1993 18:58:45 GMT""}]","2008-02-03"
"astro-ph/9311067",,"Sergio Torres","Topological Analysis of COBE-DMR CMB Maps","8, LATEX, ICRA16OCT93",,,,"astro-ph",,"  Geometric characteristics of random fields are exploited to test the
consistency of density perturbation model spectra with COBE data. These CMB
maps are analyzed using the number of anisotropy hot spots and their boundary
curvature. CMB maps which account for instrumental effects and sky coverage are
Monte Carlo generated. These simulations show that a scale invariant
Harrison-Zeldovich primordial Gaussian density fluctuation spectrum is
consistent with the data. The CMB fluctuation coherence angle, based on
boundary curvature, gives a spectral index n = 1.2 +- 0.3.
","[{""version"":""v1"",""created"":""Sun, 28 Nov 1993 17:01:11 GMT""},{""version"":""v2"",""created"":""Wed, 1 Dec 1993 15:18:07 GMT""}]","2008-02-03"
"astro-ph/9311068",,"S. Torres, R. Fabbri, R. Ruffini","The power spectrum implied by COBE and the matter correlation function","5, Latex, ICRA31-5-93",,,,"astro-ph",,"  A phenomenological power spectrum of primordial density perturbations has
been constructed by using both COBE data to probe the large wavelength region,
and a double power law, locally deduced from galaxy catalogs, which describes
the matter correlation function up to tens of Megaparsec. The shape of the
spectrum P(k) of density fluctuations exhibits a peak that singles out a
characteristic wavelength proportional to the cutoff radius R0 in the matter
distribution (comparable to the distance at which matter becomes
anticorrelated). {}From a least squares fit to COBE's angular correlation
function we obtain R0 = 35 +- 12 Mpc/h for the correlation length, and n = 0.76
+- 0.3 for the spectral index of P(k) in the large wavelength region. The
inferred scale in the spectrum is 51 +- 18 Mpc/h. This number agrees with that
derived from the analysis of the correlation function of matter and with a
preferred scale identified in IRAS PSC.
","[{""version"":""v1"",""created"":""Sun, 28 Nov 1993 17:14:09 GMT""},{""version"":""v2"",""created"":""Wed, 1 Dec 1993 16:32:36 GMT""}]","2008-02-03"
"cond-mat/9311061","Pavel Smilauer","Pavel \v{S}milauer and Dimitri D. Vvedensky","Step edge barriers on GaAs(001)","11 pages, REVTeX 3.0, IC-DDV-93-005",,"10.1103/PhysRevB.48.17603",,"cond-mat",,"  We investigate the growth kinetics on vicinal GaAs(001) surfaces by making
detailed comparisons between reflection high--energy electron--diffraction
specular intensity measured near in--phase diffraction conditions and the
surface step density obtained from simulations of a solid--on--solid model.
Only by including a barrier to interlayer transport and a short--range
incorporation process of freshly--deposited atoms can the simulations be
brought into agreement with the measurements both during growth and during
post--growth equilibration of the surface.
","[{""version"":""v1"",""created"":""Mon, 29 Nov 1993 10:15:06 GMT""}]","2009-10-22"
"hep-lat/9311049","Sinya Aoki","S. Aoki, T. Umemura, M. Fukugita, N. Ishizuka, H. Mino, M Okawa, and
  A. Ukawa","Finite-Size Effect of Hadron Masses with Kogut-Susskind Quarks","4 pages, compressed, uuencoded PostScript file(name:lat93.ps.Z)","Nucl.Phys.Proc.Suppl. 34 (1994) 363-365","10.1016/0920-5632(94)90391-3",,"hep-lat",,"  We present numerical results and their analyses of finite-size effects of
hadron masses for both quenched and full QCD calculations. We show that they
are much larger for full QCD due to dynamical sea quarks and the associated
breaking of $Z(3)$ symmetry. We also argue that finite-size effects are
non-negligible even for the largest lattice size simulation currently being
made for a very small quark mass. (talk at lattice93)
","[{""version"":""v1"",""created"":""Mon, 29 Nov 1993 01:50:44 GMT""}]","2009-10-22"
"hep-lat/9311050","Sinya Aoki","T. Onogi, S. Aoki, M. Fukugita, S. Hashimoto, N. Ishizuka, H. Mino,
  M.Okawa, and A. Ukawa","Sea Quark Effects on the Strong Coupling Constant","3 pages, compressed, uuencoded PostScript file(name:lat93ch.ps.Z)","Nucl.Phys.Proc.Suppl. 34 (1994) 492-494","10.1016/0920-5632(94)90427-8",,"hep-lat",,"  We present results showing that the strong coupling constant measured in
two-flavor full QCD with dynamical Kogut-Susskind quarks at $\beta=5.7$ exhibit
a 15\% increase due to sea quarks over that for quenched QCD at the scale
$\mu\approx 7$GeV . (talk at lattice93)
","[{""version"":""v1"",""created"":""Mon, 29 Nov 1993 02:03:34 GMT""}]","2009-10-22"
"hep-lat/9311051","Tomoteru Yoshie","QCDPAX collaboration: Y.Iwasaki, K.Kanaya, S.Sakai, T.Yoshie,
  T.Hoshino and T.Shirakawa","High statistics calculations of quenched QCD spectrum using various
  quark sources","3 pages, 2 postscript figures, to appear in the Proceedings of
  LATTICE 93, Dallas, USA; preprint UTHEP-267","Nucl.Phys.Proc.Suppl. 34 (1994) 354-356","10.1016/0920-5632(94)90388-3",,"hep-lat",,"  We present the results for the hadron spectrum calculated on 400
configurations using point source, wall source and 8-cubic sources, in quenched
QCD with Wilson fermions at $\beta=6.0$ and $K=0.155$ on a $24^3 \times 54$
lattice. The results for the ground state masses obtained with three types of
quark sources agree well with each other. Masses of the first excited states
appear consistent with experimental values within large errors.
","[{""version"":""v1"",""created"":""Mon, 29 Nov 1993 03:32:08 GMT""}]","2009-10-22"
"hep-lat/9311052","Wolfgang Sakuler","Manfried Faber, Harald Markum, Stefan Olejnik and Wolfgang Sakuler","Topological charge density around static color sources","3 pages PostScript, uuencoded, contribution to Lattice 93","Nucl.Phys.Proc.Suppl.34:167-169,1994","10.1016/0920-5632(94)90335-2",,"hep-lat",,"  We analyze the topological structure of quenched QCD in the presence of
static color sources. Distributions of the topological charge density around
static quarks and mesons are computed in both phases of QCD. We observe a
suppression of topological fluctuations in the vicinity of external sources. In
the confinement phase, the suppression occurs in the whole flux tube between
the static quark and antiquark.
","[{""version"":""v1"",""created"":""Mon, 29 Nov 1993 10:40:09 GMT""}]","2008-11-26"
"hep-lat/9311053","Gunnar Bali","G.S. Bali, K. Schilling, C. Schlichter","SU(2) Colour Fields Around Static Sources","3 pages (LaTeX) with 4 epsf incl. PS figs., To be publ. in Proc. of
  Lattice '93","Nucl.Phys.Proc.Suppl. 34 (1994) 216-218","10.1016/0920-5632(94)90349-2",,"hep-lat",,"  First results of an ongoing high statistics study of the colour flux
distribution around static quark sources in SU(2) gauge theory are presented.
The flux tube profiles and widths have been investigated for several quark
separations at beta=2.5 and beta=2.74. The results are tested against Michael's
sum rules.
","[{""version"":""v1"",""created"":""Mon, 29 Nov 1993 12:25:37 GMT""}]","2009-10-22"
"hep-lat/9311054","Gunnar Bali","K. Schilling, G.S. Bali","Alpha_s from the Lattice Potential","6 pages (LaTeX) with 7 postscript figures (epsf required), Invited
  talk by K. Schilling held at Lattice '93 conference, Dallas, TX","Nucl.Phys.Proc.Suppl.34:147-152,1994","10.1016/0920-5632(94)90331-X",,"hep-lat",,"  We present an extensive study on the direct determination of the running
coupling alpha_s from the static quark antiquark force at short distances, in
quenched QCD. We find from our high statistics potential analysis that alpha_qq
exhibits two-loop asymptotic behaviour for momenta as low as .5 GeV. As a
result, we determine the zero flavour Lambda-parameter to be Lambda^0_MSBAR =
0.630(38)\sqrt{\sigma} = 293(18)^{+25}_{-63} MeV. A rough estimate of full QCD
effects leads to the five flavour value alpha_MSBAR(m_Z) = .102^{+6}_{-11}. A
comparison with other lattice results is made.
","[{""version"":""v1"",""created"":""Mon, 29 Nov 1993 12:34:00 GMT""}]","2011-07-19"
"hep-lat/9311055","V. Mitrjushkin","J. Engels, V. K. Mitrjushkin and T. Neuhaus","The analysis of Polyakov loop and spin correlators in finite volumes","TALK GIVEN AT THE LATTICE '93 INTERNATIONAL SYMPOSIUM LATTICE FIELD
  THEORY, DALLAS, USA, OCTOBER 12--16, 1993 3 pages preprint HU
  BERLIN--IEP--93/5 and BIELEFELD BI-TP--93/63, November 1993","Nucl.Phys.Proc.Suppl. 34 (1994) 298-300","10.1016/0920-5632(94)90372-7",,"hep-lat",,"  We derive an analytic expression for point to point correlation functions of
the Polyakov loop based on the transfer matrix formalism. The contributions
from the eigenvalues of the transfer matrix including and beyond the mass gap
are investigated both for the $2d$ Ising model and in finite temperature
$SU(2)$ gauge theory. We find that the leading matrix element shows similar
scaling properties in both models. Just above the critical point we obtain for
$SU(2)$ a Debye screening mass $~\mu_D/T\approx4~$, independent of the volume.
Sorry, figures are not included and can be sent by ordinary mail.
","[{""version"":""v1"",""created"":""Mon, 29 Nov 1993 15:08:21 GMT""}]","2009-10-22"
"hep-ph/9311368","Tomo Munehisa","J.Fujimoto, Y.Shimizu and T.Munehisa","Monte Carlo Approach to Radiative Corrections in Bhabha Scattering","12 pages, LaTeX, 4 figures available on request KEK-CP-009,KEK
  Preprint 93-149","Prog.Theor.Phys. 91 (1994) 333-340","10.1143/ptp/91.2.333",,"hep-ph",,"  A new Monte Carlo model is proposed for radiative corrections to Bhabha
scattering by extending QEDPS developed for multi-photon emission in muon pair
production in $e^+e^-$ annihilation. This is the QED version of the model known
as parton shower in QCD. The main difference between muon pair production and
Bhabha scattering is that the latter cross section shows the singularity of
$1/t^2$. A shower algorithm is constructed on the radiator formalism modified
in a suitable form for this singularity. Some results of the model are
presented and compared with $O(\alpha)$ corrections.
","[{""version"":""v1"",""created"":""Mon, 29 Nov 1993 03:11:30 GMT""}]","2017-02-01"
"hep-ph/9311369","C. L. Lee","Clarence L. Lee","Evaluation of the One-loop Effective Action at Zero and Finite
  Temperature","13 pages plus 1 figure in jyTex; CALT-68-1903","Phys.Rev.D49:4101-4106,1994","10.1103/PhysRevD.49.4101",,"hep-ph",,"  A method for determining the leading quantum contributions to the effective
action for both zero and finite temperatures is presented. While it is
described in the context of a scalar field theory, it can be straight-forwardly
extended to include fermions. An extrapolation procedure which can
significantly enhance the computational efficiency is introduced. This
formalism is used to investigate quantum corrections to the nucleation rate in
first-order phase transitions.
","[{""version"":""v1"",""created"":""Mon, 29 Nov 1993 07:44:37 GMT""}]","2010-11-01"
"hep-ph/9311370","Layssac Jacques","J. Layssac, F.M. Renard, G. Gounaris","Unitarity Constraints for Transverse Gauge Bosons at LEP and
  Supercolliders","11 pages,postscript file of 1 figure appended at the end of the latex
  file (e-mail layssac@lpmsun2.lpm.univ-montp2.fr PM/93-37 THES-TP 93/11","Phys.Lett. B332 (1994) 146-152","10.1016/0370-2693(94)90872-9",,"hep-ph",,"  Using asymptotic helicity amplitudes for Vector-Vector, Vector-Higgs and
Higgs-Higgs scattering, we establish the unitarity constraints on the $SU(2)_c$
conserving and $W_\mu$ depending interactions, which at sufficiently high
energies may create strong forces among the transverse vector boson and Higgs
states. We then derive upper bounds for the couplings of these interactions,
which depend on the high energy scale where unitarity is saturated. If \eg\,
unitarity is saturated at 1TeV, then $\lambda_W \lsim 0.12$ is obtained. The
implied relations between the present and future LEP results, and the possible
observations of strong effects at supercolliders, are also discussed
","[{""version"":""v1"",""created"":""Mon, 29 Nov 1993 10:41:49 GMT""}]","2019-08-17"
"hep-th/9311162","Mark de Wild Propitius","F.A. Bais and M. de Wild Propitius","Quantumgroups in the Higgs Phase","19 pages in Latex, ITFA-93-30","Theor.Math.Phys. 98 (1994) 357-367; Teor.Mat.Fiz. 98 (1994)
  509-523","10.1007/BF01102213",,"hep-th",,"  In the Higgs phase we may be left with a residual finite symmetry group H of
the condensate. The topological interactions between the magnetic- and electric
excitations in these so-called discrete H gauge theories are completely
described by the Hopf algebra or quantumgroup D(H). In 2+1 dimensional space
time we may add a Chern-Simons term to such a model. This deforms the
underlying Hopf algebra D(H) into a quasi-Hopf algebra by means of a 3-cocycle
H. Consequently, the finite number of physically inequivalent discrete H gauge
theories obtained in this way are labelled by the elements of the cohomology
group H^3(H,U(1)). We briefly review the above results in these notes. Special
attention is given to the Coulomb screening mechanism operational in the Higgs
phase. This mechanism screens the Coulomb interactions, but not the
Aharonov-Bohm interactions. (Invited talk given by Mark de Wild Propitius at
`The III International Conference on Mathematical Physics, String Theory and
Quantum Gravity', Alushta, Ukraine, June 13-24, 1993. To be published in Theor.
Math. Phys.)
","[{""version"":""v1"",""created"":""Sun, 28 Nov 1993 17:45:41 GMT""}]","2009-10-22"
"hep-th/9311163",,"T. D. Palev","Quantization of U_q[so(2n+1)] with deformed para-Fermi operators","plain TeX, Preprint INRNE-TH-93/7, 6 p","Lett.Math.Phys. 31 (1994) 151-158","10.1007/BF00750149",,"hep-th",,"  The observation that n pairs of para-Fermi (pF) operators generate the
universal enveloping algebra of the orthogonal Lie algebra so(2n+1) is used in
order to define deformed pF operators. It is shown that these operators are an
alternative to the Chevalley generators. On this background Uq[so(2n+1)] and
its ""Cartan-Weyl"" generators are written down entirely in terms of deformed pB
operators.
","[{""version"":""v1"",""created"":""Sun, 28 Nov 1993 19:24:21 GMT""}]","2009-10-22"
"hep-th/9311164","Ian Kogan","Ian I. Kogan","Hot Gauge Theories and $Z_{N}$ Phases","preprint PUPT-1415, 21 p","Phys.Rev.D49:6799-6809,1994","10.1103/PhysRevD.49.6799",,"hep-th",,"  In this paper the several aspects of the $Z_{N}$ symmetry in gauge theories
at high temperatures are discussed. The metastable $Z_{N}$ bubbles in the
$SU(N)$ gauge theories with fermions may have, generically, unacceptable
thermodynamic behavior. Their free energy $F \propto T^4$ with a positive
proportionality constant. This leads not only to negative pressure but also to
negative specific heat and, more seriously, to negative entropy. We argue that
although such domains are important in the Euclidean theory, they cannot be
interpreted as physical domains in Minkowski space. The related problem is
connected with the analysis of the high-temperature limit of the confining
phase. Using the two-dimensional QCD with adjoint fermions as a toy model we
shall demonstrate that in the light fermion limit in this theory there is no
breaking of the $Z_{N}$ symmetry in the high-temperature limit and thus there
are no $Z_{N}$ bubbles.
","[{""version"":""v1"",""created"":""Sun, 28 Nov 1993 23:41:15 GMT""}]","2010-11-01"
"hep-th/9311165","Rabindranath Chatterjee","R.Chatterjee and A.Zamolodchikov","Local Magnetization in Critical Ising Model with Boundary Magnetic Field","8 pages, RU-93-54",,"10.1142/S0217732394002082",,"hep-th",,"  We discribe a simple way to derive spin correlation functions in 2D Ising
model at critical temperature but with nonzero magnetic field at the boundary.
Local magnetization (i.e. one-point function) is computed explicitly for
half-plane and disk geometries.
","[{""version"":""v1"",""created"":""Mon, 29 Nov 1993 01:58:42 GMT""}]","2015-06-26"
"hep-th/9311166","Tatsuo Kobayashi","H.Kawabe, T.Kobayashi and N.Ohtsubo","Levels of U(1)y in Minimal String Model on Z(N)*Z(M) Orbifolds","14 pages, KANAZAWA-93-12, Latex file","Phys.Lett.B325:77-84,1994","10.1016/0370-2693(94)90075-2",,"hep-th",,"  We study a minimal string model possessing the same massless spectra as the
  MSSM on $Z_N\times Z_M$ orbifolds. Threshold corrections of the gauge
coupling constants of SU(3), SU(2) and
  U(1)$_Y$ are investigated in a case of an overall modulus. Using computer
analyses, we search ranges of levels of U(1)$_Y$ allowed by the LEP
experiments. It is found that $Z_3\times Z_3$ can not derive the minimal string
model for a $M_Z$ SUSY breaking scale. The minimum values of the overall moduli
are estimated within the ranges of the levels.
","[{""version"":""v1"",""created"":""Mon, 29 Nov 1993 07:37:19 GMT""}]","2010-11-01"
"hep-th/9311167","Mikhail Saveliev","A. V. Razumov and M. V. Saveliev","Differential Geometry of Toda Systems","41 pages, AMSLaTeX file","Commun.Anal.Geom. 2 (1994) 461-511",,"LPTENS-93/45","hep-th alg-geom math.DG",,"  In the present paper we give a differential geometry formulation of the basic
dynamical principle of the group--algebraic approach \cite{LeS92} --- the
grading condition --- in terms of some holomorphic distributions on flag
manifolds associated with the parabolic subgroups of a complex Lie group; and a
derivation of the corresponding nonlinear integrable systems, and their general
solutions. Moreover, the reality condition for these solutions is introduced.
For the case of the simple Lie groups endowed with the canonical gradation,
when the systems in question are reduced to the abelian Toda equations, we
obtain the generalised Pl\""ucker representation for the pseudo--metrics
specified by the K\""ahler metrics on the flag manifolds related to the maximal
nonsemisimple parabolic subgroups; and the generalised infinitesimal Pl\""ucker
formulas for the Ricci curvature tensors of these pseudo--metrics. In
accordance with these formulas, the fundamental forms of the pseudo--metrics
and the Ricci curvature tensors are expressed directly in terms of the abelian
Toda fields, which have here the sense of K\""ahler potentials.
","[{""version"":""v1"",""created"":""Mon, 29 Nov 1993 13:26:58 GMT""},{""version"":""v2"",""created"":""Fri, 2 Sep 1994 12:54:47 GMT""}]","2008-02-03"
"hep-th/9311168","Christoph Schweigert","Christoph Schweigert","Poincare Polynomials and Level Rank Dualities in the $N=2$ Coset
  Construction","14 pages in LaTeX, HD-THEP-93-43","Theor.Math.Phys. 98 (1994) 326-334; Teor.Mat.Fiz. 98 (1994)
  467-478","10.1007/BF01102209",,"hep-th",,"  We review the coset construction of conformal field theories; the emphasis is
on the construction of the Hilbert spaces for these models, especially if fixed
points occur. This is applied to the $N=2$ superconformal cosets constructed by
Kazama and Suzuki. To calculate heterotic string spectra we reformulate the
Gepner con- struction in terms of simple currents and introduce the so-called
extended Poincar\'e polynomial. We finally comment on the various equivalences
arising between models of this class, which can be expressed as level rank
dualities. (Invited talk given at the III. International Conference on
Mathematical Physics, String Theory and Quantum Gravity, Alushta, Ukraine, June
1993. To appear in Theor. Math. Phys.)
","[{""version"":""v1"",""created"":""Mon, 29 Nov 1993 14:12:31 GMT""}]","2009-10-22"
"nucl-th/9311035",,"Sadhan K. Adhikari, T. Frederico, and Lauro Tomio","Relativistic three-particle dynamical equations: I. Theoretical
  development","30 pages, Report # IFT P.070/93, [Text in Latex, e-mail:
  tomio@ift.uesp.ansp.br ; FAX: 55-11-288-8224]","Annals Phys. 235 (1994) 77-102","10.1006/aphy.1994.1091",,"nucl-th",,"  Starting from the two-particle Bethe-Salpeter equation in the ladder
approximation and integrating over the time component of momentum, we rederive
three dimensional scattering integral equations satisfying constraints of
relativistic unitarity and covariance, first derived by Weinberg and by
Blankenbecler and Sugar. These two-particle equations are shown to be related
by a transformation of variables. Hence we show how to perform and relate
identical dynamical calculation using these two equations. Similarly, starting
from the Bethe-Salpeter-Faddeev equation for the three-particle system and
integrating over the time component of momentum, we derive several three
dimensional three-particle scattering equations satisfying constraints of
relativistic unitarity and covariance. We relate two of these three-particle
equations by a transformation of variables as in the two-particle case. The
three-particle equations we derive are very practical and suitable for
performing relativistic scattering calculations.
","[{""version"":""v1"",""created"":""Mon, 29 Nov 1993 13:06:00 GMT""},{""version"":""v2"",""created"":""Mon, 29 Nov 1993 16:59:00 GMT""}]","2009-10-22"
