"hep-th/9305047","Vladimir Kazakov","Michael R. Douglas and Vladimir A.Kazakov","Large $N$ Phase Transition in Continuum QCD$_2$","17 pages, preprint LPTENS-93/20 and RU-93-17","Phys.Lett. B319 (1993) 219-230","10.1016/0370-2693(93)90806-S",,"hep-th",,"  We compute the exact partition function for pure continuous Yang-Mills theory
on the two-sphere in the large $N$ limit, and find that it exhibits a large $N$
third order phase transition with respect to the area $A$ of the sphere. The
weak coupling (small A) partition function is trivial, while in the strong
coupling phase (large A) it is expressed in terms of elliptic integrals. We
expand the strong coupling result in a double power series in $e^{-g^2 A}$ and
$g^2 A$ and show that the terms are the weighted sums of branched coverings
proposed by Gross and Taylor. The Wilson loop in the weak coupling phase does
not show the simple area law. We discuss some consequences for higher
dimensions.
","[{""version"":""v1"",""created"":""Wed, 12 May 1993 00:22:29 GMT""}]","2009-10-22"
"hep-th/9305049","David Fairlie","D.B. Fairlie","Equations of Hydrodynamic Type","10 pages, PlainTeX, DTP/93/31",,,,"hep-th",,"  The universal field equations introduced by the author and his collaborators,
which admit infinitely many inequivalent Lagrangian formulations are shown to
arise as consistency conditions for the existence of non-trivial solutions to
the quasi-linear equations, called equations of hydrodynamic type by Novikov ,
Dubrovin and others. The solutions in closed form are only implicit. A method
due to Stokes, which is in essence just Fourier Analysis is resurrected for
application to those equations. With the benefit of algebraic computation
facilities, this method, allows the general structure of power series solutions
to be conjectured.
","[{""version"":""v1"",""created"":""Wed, 12 May 1993 14:34:58 GMT""}]","2007-05-23"
"hep-th/9305050","David Fairlie","D.B. Fairlie and A.N. Leznov","The Integrable Mapping as the Discrete Group of Inner Symmetry of
  Integrable Systems","7, LaTeX, DTP/93/33",,,,"hep-th",,"  It is shown that each integrable mapping is connected with a hierarchical
completely integrable sytem of equations of evolution type which are invariant
with respect to the transformation described by this mapping.
","[{""version"":""v1"",""created"":""Wed, 12 May 1993 14:29:53 GMT""}]","2007-05-23"
"math/9305203",,"P. Mankiewicz, Stanislaw J. Szarek","Random Banach spaces. The limitations of the method",,,,"Banach Archive 5/11/93","math.FA",,"  We study the properties of ""generic"", in the sense of the Haar measure on the
corresponding Grassmann manifold, subspaces of l^N_infinity of given dimension.
We prove that every ""well bounded"" operator on such a subspace, say E, is a
""small"" perturbation of a multiple of identity, where ""smallness"" is defined
intrinsically in terms of the geometry of E. In the opposite direction, we
prove that such ""generic subspaces of l^N_infinity"" do admit ""nontrivial well
bounded"" projections, which shows the ""near optimality"" of the first mentioned
result, and proves the so called ""Pisier's dichotomy conjecture"" in the
""generic"" case.
","[{""version"":""v1"",""created"":""Tue, 11 May 1993 20:56:21 GMT""}]","2016-09-06"
"nucl-th/9305006","Vesteinn Thorsson","V. Thorsson, M. Prakash and J. M. Lattimer","Composition, Structure and Evolution of Neutron Stars with Kaon
  Condensates","31 Pages, 8 Tables ( LaTeX ), 14 uuencoded, tar-compressed postscript
  figures, NORDITA-93/29 N, SUNY-NTG-92-33","Nucl.Phys. A572 (1994) 693-731; Erratum-ibid. A574 (1994) 851","10.1016/0375-9474(94)90407-3",,"nucl-th astro-ph",,"  We investigate the possibility of kaon condensation in the dense interior of
neutron stars through the s--wave interaction of kaons with nucleons. We
include nucleon--nucleon interactions by using simple parametrizations of
realistic forces, and include electrons and muons in $\beta$--equilibrium. The
conditions under which kaon condensed cores undergo a transition to quark
matter containing strange quarks are also established. The critical density for
kaon condensation lies in the range (2.3--5.0)$~\rho_0$, where
$\rho_0=0.16$~fm$^{-3}$ is the equilibrium density of nuclear matter. For too
large a value of the strangeness content of the proton, matter with a kaon
condensate is not sufficiently stiff to support the lower limit of $1.44
M_\odot$ for a neutron star. Kaon condensation dramatically increases the
proton abundance of matter and even allows positrons to exist inside the core.
We also consider the case when neutrinos are trapped in the matter. Neutrino
trapping shifts both kaon condensation and the quark matter transition to
higher densities than in the case of cold, catalyzed matter. A newly--formed
neutron star is expected to have a rather low central density, the density
rising only after mass accretion onto the star ends after a few seconds. Thus,
it is likely that if kaon condensation and/or the quark--hadron phase
transition occur, they do so only during or after the mass accretion and
neutrino trapping stages. We suggest that neutrino observations from a galactic
supernova may provide direct evidence for or against a condensate and/or a
quark--hadron transition.
","[{""version"":""v1"",""created"":""Tue, 11 May 1993 16:55:19 GMT""}]","2009-10-22"
"nucl-th/9305007","Peter Henning","P.A.Henning","The column vector calculus for Thermo Field Dynamics of relativistic
  quantum fields","10 pages, GSI-Preprint 93-32 (1993)","Phys.Lett. B313 (1993) 341-346","10.1016/0370-2693(93)90001-X",,"nucl-th",,"  A formalism is discussed which simplifies the calculation of Feynman diagrams
at finite temperature.
","[{""version"":""v1"",""created"":""Wed, 12 May 1993 08:20:13 GMT""}]","2009-10-22"
