"hep-th/9305059",,"Ziemowit Popowicz (Research Institute for Theoretical Physics,
  University of Helsinki, Finland)","The Super W_3 Conformal Algebra and the Boussinesq Hierarchy","12 pages","Int.J.Mod.Phys. A9 (1994) 2001-2012","10.1142/S0217751X94000844",,"hep-th",,"  The bihamiltonian structure of the N=2 Supersymmetric Boussinesq equation is
found. It is not reduced to the corresponding classical structure and hence it
describes the pure supersymmetric effect. For the supersymmetric Boussinesq
equation which contains the classical partner the Lax pair is given explicitly.
Thus we prove the integrability of the equation.
","[{""version"":""v1"",""created"":""Thu, 13 May 1993 13:18:48 GMT""}]","2015-06-26"
"nucl-th/9305008",,"Hiroyuki Yabu, Shinji Nakamura, F. Myhrer, and K. Kubodera","Effective Kaon Mass in Baryonic Matter and Kaon Condensation","12pages, USC(NT)-95-5","Phys.Lett. B315 (1993) 17-23","10.1016/0370-2693(93)90151-7",,"nucl-th",,"  The effective kaon mass in dense baryonic matter is calculated based on PCAC,
current algebra and the Weinberg smoothness hypothesis. The off-shell behavior
of the K-N scattering amplitudes is treated consistently with PCAC, and the
effects of the subthreshold K-N resonances are also included. The effective
kaon mass is found to depend crucially on the K-N sigma term. Since the current
estimates of K-N Sigma term are very uncertain, we discuss various scenarios
treating K-N Sigma term as an input parameter; for certain values of K-N Sigma
a collective mode of a hyperon-particle-nucleon-hole state appears at high
densities, possibly leading to kaon condensation.
","[{""version"":""v1"",""created"":""Thu, 13 May 1993 15:06:16 GMT""}]","2009-10-22"
"solv-int/9305001",,"Ziemowit Popowicz (Research Institute for Theoretical Physics,
  Siltavuorenpenger 20C, Fin-00014 University of Helsinki Finland)","The Super W_3 Conformal Algebra and the Boussinesq Hierarchy","12 pages",,"10.1142/S0217751X94000844",,"solv-int nlin.SI",,"  The bihamiltonian structure of the N=2 Supersymmetric Boussinesq equation is
found. It is not reduced to the corresponding classical structure and hence it
describes the pure supersymmetric effect. For the supersymmetric Boussinesq
equation which contains the classical partner the Lax pair is given
explicitely. Thus we prove the integrability of the equation.
","[{""version"":""v1"",""created"":""Thu, 13 May 1993 13:20:09 GMT""}]","2009-10-22"
