"alg-geom/9305005","Atsushi Moriwaki","Atsushi Moriwaki","Inequality of Bogomolov-Gieseker's type on arithmetic surfaces","51 pages, AmSTeX",,,,"alg-geom math.AG",,"  Let K be an algebraic number field, O_K the ring of integers of K, and f : X
--> Spec(O_K) an arithmetic surface. Let (E, h) be a rank r Hermitian vector
bundle on X such that $E$ is semistable on the geometric generic fiber of f. In
this paper, we will prove an arithmetic analogy of Bogomolov-Gieseker's
inequality: c_2(E, h) - (r-1)/(2r) c_1(E, h)^2 >= 0.
","[{""version"":""v1"",""created"":""Wed, 12 May 1993 18:40:00 GMT""}]","2008-02-03"
"astro-ph/9305015","Tsvi Piran","Christopher S. Kochanek and Tsvi Piran","Gravitational Waves and $\gamma$-Ray Bursts","6 pages, tex, 1 figure not included, can be obtained by request from
  tsvi@cfata4.harvard.Edu CFA-3637","Astrophys.J. 417 (1993) L17-L20","10.1086/187083",,"astro-ph gr-qc",,"  Coalescing binaries in distant galaxies are one of the most promising sources
of gravitational waves detectable by the LIGO project.$^{[1-5]}$ They are also
a copious source of neutrinos,$^{[1]}$ however these neutrino pulses are far
too weak to be detected on earth. Several years ago Eichler \etal$\,$$^{[6]}$
suggested that they are also sources of $\gamma$-ray bursts (GRBs). Recently it
was found$^{[7]}$ that GRBs are likely to be cosmological in origin, and
coalescing binary systems$^{[6,8-11]}$ are probably the most promising
cosmological sources. The current estimates of the burst and LIGO rates from a
cosmologically distributed population are based on the systems observed in our
galaxy.$^{[12-14]}$ These estimates are based on only three binarys so there
are large statistical uncertainties in the coalescence rate. If we accept the
cosmological/coalescing binary hypothesis for GRBs, then we get a more accurate
estimate of the rate at which binaries coalesce and hence of the predicted LIGO
signal. The association between GRBs and binaries can significantly improve the
performance of LIGO. The detection of gravitational radiation from a GRB source
not only confirms the coalescing binary model, but it will also provide
information on the geometry and energy generation mechanism of the burst.
","[{""version"":""v1"",""created"":""Wed, 12 May 1993 16:15:48 GMT""},{""version"":""v2"",""created"":""Thu, 13 May 1993 17:59:05 GMT""}]","2009-10-22"
"astro-ph/9305017","Arne Saknussen","Simone R. Zaggia, Massimo Capaccioli, and Giampaolo Piotto","High resolution kinematics of galactic globular clusters. II. On the
  significance of velocity dispersion measurements","6 pages, 8 figures upon request, Latex A&A style version 3.0,
  DAPD-209",,,,"astro-ph",,"  Small number statistics may heavily affect the structure of the broadening
function in integrated spectra of galactic globular cluster centers. As a
consequence, it is a priori unknown how closely line broadening measure- ments
gauge the intrinsic velocity dispersions at the cores of these stel- lar
systems. We have tackled this general problem by means of Monte Carlo
simulations. An examination of the mode and the frequency distribution of the
measured values of the simulations indicates that the low value measured for
the velocity dispersion of M30 (Zaggia etal 1992) is likely a reliable estimate
of the velocity dispersion at the center of this cluster. The same methodology
applied to the case of M15 suggests that the steep inward rise of the velocity
dispersion found by Peterson, Seitzer and Cudworth (1989) is real, although
less pronounced. Large-aperture observa- tions are less sensitive to
statistical fluctuations, but are unable to detect strong variations in the
dispersion wich occur within the aperture itself.
","[{""version"":""v1"",""created"":""Thu, 13 May 1993 10:26:23 GMT""}]","2007-05-23"
"chao-dyn/9305004","G. Eilenberger","G. Eilenberger (IFF, KFA J\""ulich, FRG) K. Schmidt (EDS Deutschland,
  R\""usselsheim, FRG)","Poincar\'e maps of Duffing--type oscillators and their reduction to
  circle maps. I. Analytic results","32 pages, TeX, preprint.sty file included",,,,"chao-dyn nlin.CD",,"  Bifurcation diagrams and plots of Lyapunov exponents in the $r$--$\Omega$
--plane for Duffing--type oscillators $$\ddot x +2r\dot x +V'(x,\Omega t) =0$$
exhibit a regular pattern of repeating selfsimilar ``tongues'' with complex
internal structure. We demonstrate here that this behaviour is easily
understood qualitatively and quantitatively from the Poincar\'e map of the
system in action--angle variables. This map approaches the {\it one
dimensional} form $$\varphi_{n+1} = A + C \e^{-r T} \cos \varphi_n, \ \ T= \pi
/ \Omega$$ provided $\e^{-r T}$ (but not necessarily $C \e^{- r T}$), $r$ and
$\Omega$ are small.
  We derive asymptotic (for $r$, $\Omega$ small) formulae for $A$ and $C$ for a
special class of potentials $V$. We argue that these special cases contain all
the information needed to treat the general case of potentials which obey $V''
\ge 0$ at all times. The essential tools of the derivation are the use of
action--angle variables, the adiabatic approximation and the introduction of a
nonoscillating reference solution of Duffing's equation, with respect to which
the action-angle variables have to be determined. These allow the explicit
construction of the Poincar\'e map in powers of $\e^{-rT}$. To first order, we
obtain the $\varphi$--map, which survives asymptotically. To {\it second} order
we obtain the two--dimensional $I$--$\varphi$--map. In $I$--direction it
contracts by a factor $\e^{-rT}$ upon each iteration.
","[{""version"":""v1"",""created"":""Thu, 13 May 1993 10:27:06 GMT""}]","2008-02-03"
"cond-mat/9305008","Mike Norman","M. R. Norman","Hunds Rule Theory for Heavy Fermion Superconductors","revised manuscript, 15 pages (Plain TeX with macros), plus 1
  postscript figure","Phys Rev Lett 72, 2077 (1994)","10.1103/PhysRevLett.72.2077",,"cond-mat",,"  In this paper, a generalization of standard spin fluctuation theory is
considered which takes into account orbital degeneracy effects which are
critical for describing f electrons. This theory leads to an instability for a
superconducting pair state which obeys Hunds rules. Such a state has L=5, S=1,
and J=4. The degeneracy of this state is broken by crystalline effects, and
realistic calculations for $UPt_3$ find a resultant pair state with
$\Gamma_6^-$ symmetry, consistent with current experimental constraints.
","[{""version"":""v1"",""created"":""Wed, 12 May 1993 22:49:22 GMT""},{""version"":""v2"",""created"":""Fri, 19 Nov 1993 23:35:16 GMT""}]","2009-10-22"
"cond-mat/9305009","Kurt Langfeld","K. Langfeld, E. Frey","Anisotropic Electron Coupling as a Phenomenological Model for
  High-Temperature Superconductors","13 LaTex pages using RevTex (3 figures available on request),
  UNITUE-THEP-6-1993",,"10.1103/PhysRevB.48.4176",,"cond-mat",,"  A three-dimensional weak coupling BCS model with an {\it anisotropic} pairing
interaction in momentum space is reported. It exhibits an anisotropic gap in
accord with recent experimental observations for high-$T_c$ oxides. The gap
ratio ${2 \Delta / k_B T_c }$ is calculated as function of the anisotropy ratio
of the electron pairing. It is found that the mean gap ratio decreases with
increasing anisotropy of the electron pairing, whereas the maximum gap ratio
increases. Assuming a unique strength of the effective electron interaction the
transition temperature turns out to be always larger than in the isotropic
case. The temperature dependence of the gap in the Cu-O plane and along the
c-axis of YBaCuO is presented.
","[{""version"":""v1"",""created"":""Thu, 13 May 1993 09:22:09 GMT""}]","2009-10-22"
"cond-mat/9305010","Per Arne Rikvold","Howard L. Richards, M. A. Novotny, and Per Arne Rikvold","A Numerical Transfer-Matrix Study of Surface-Tension Anisotropy in Ising
  Models on Square and Cubic Lattices","40 pages, 17 figures available on request. RevTeX version 2.1","Phys. Rev. B, 48 (1993) 14584-14598","10.1103/PhysRevB.48.14584","FSU-SCRI-93-59","cond-mat hep-lat",,"  We compute by numerical transfer-matrix methods the surface free energy
$\tau(T),$ the surface stiffness coefficient $\kappa(T),$ and the single-step
free energy $s(T)$ for Ising ferromagnets with $(\infty \times L)$
square-lattice and $(\infty \times L \times M)$ cubic-lattice geometries, into
which an interface is introduced by imposing antiperiodic or plus/minus
boundary conditions in one transverse direction. These quantities occur in
expansions of the angle-dependent surface tension, either for rough or for
smooth interfaces. The finite-size scaling behavior of the interfacial
correlation length provides the means of investigating $\kappa(T)$ and $s(T).$
The resulting transfer-matrix estimates are fully consistent with previous
series and Monte Carlo studies, although current computational technology does
not permit transfer-matrix studies of sufficiently large systems to show
quantitative improvement over the previous estimates.
","[{""version"":""v1"",""created"":""Thu, 13 May 1993 14:46:58 GMT""}]","2009-10-22"
"funct-an/9305002","Sylvie Zaffanella","J. Bros, G.A. Viano","Connection between the harmonic analysis on the sphere and the harmonic
  analysis on the one-sheeted hyperboloid: an analytic continuation viewpoint",,,,"Saclay-T93/039","funct-an math.FA",,"  In a previous paper $[$B,V-1$]$, an algebra of holomorphic ``perikernels'' on
a complexified hyperboloid $ X^{(c)}_{d-1} $ (in $\Bbb C^d)$ has been
introduced; each perikernel $ {\cal K} $ can be seen as the analytic
continuation of a kernel $ {\bf K} $ on the unit sphere $ \Bbb S^{d-1} $ in an
appropriate ``cut-domain'' , while the jump of $ {\cal K} $ across the
corresponding ``cut'' defines a Volterra kernel $ K $ (in the sense of J.
Faraut $\lbrack$Fa-1$\rbrack$) on the one-sheeted hyperboloid $ X_{d-1} $ (in $
\Bbb R^d). $ \par In the present paper, we obtain results of harmonic analysis
for classes of perikernels which are invariant under the group $ {\rm
SO}(d,\Bbb C) $ and of moderate growth at infinity. For each perikernel $ {\cal
K} $ in such a class, the Fourier-Legendre coefficients of the corresponding
kernel $ {\bf K} $ on $ \Bbb S^{d-1} $ admit a carlsonian analytic
interpolation $ \tilde F(\lambda) $ in a half-plane, which is the ``spherical
Laplace transform''\ of the associated Volterra kernel $K$ on $ X_{d-1}. $
Moreover, the composition law $ {\cal K }= {\cal K}_1\ast^{( c)}{\cal K}_2 $
for perikernels (interpreted in terms of convolutions for the
","[{""version"":""v1"",""created"":""Wed, 12 May 1993 21:24:00 GMT""}]","2016-08-31"
"gr-qc/9305011","Peter Peldan","Peter Peldan","Actions for Gravity, with Generalizations: A Review","61 pages, ITP 93-13","Class.Quant.Grav.11:1087-1132,1994","10.1088/0264-9381/11/5/003",,"gr-qc",,"  Related to the classical Ashtekar Hamiltonian, there have been discoveries
regarding new classical actions for gravity in (2+1)- and (3+1)-dimensions, and
also generalizations of Einstein's theory of gravity. In this review, I will
try to clarify the relations between the new and old actions for gravity, and
also give a short introduction to the new generalizations. The new
results/treatments in this review are: 1. A more detailed constraint analysis
of the Hamiltonian formulation of the Hilbert- Palatini Lagrangian in
(3+1)-dimensions. 2. The canonical transformation relating the Ashtekar- and
the ADM-Hamiltonian in (2+1)-dimensions is given. 3. There is a discussion
regarding the possibility of finding a higher dimensional Ashtekar formulation.
There are also two clarifying figures (in the beginning of chapter 2 and 3,
respectively) showing the relations between different action-formulations for
Einstein gravity in (2+1)- and (3+1)-dimensions.
","[{""version"":""v1"",""created"":""Thu, 13 May 1993 09:10:03 GMT""}]","2010-04-06"
"hep-ph/9305254","My Account","J. Lopez, D. Nanopoulos, and X. Wang","LEP and radiative electroweak breaking close the light gluino window","6 pages, no figures, tex (harvmac), CERN-TH.6890, CTP-TAMU-25/93","Phys.Lett.B313:241-244,1993","10.1016/0370-2693(93)91219-D",,"hep-ph",,"  We show that the LEP lower bound on the chargino mass, in conjunction with
the well motivated theoretical requirement of radiative electroweak symmetry
breaking, imply an upper bound on the lightest Higgs boson mass
($m_h\lsim62\GeV$) in a supersymmetry breaking scenario where the gluino mass
is a few GeV. Moreover, Higgs searches at LEP in the context of this model
require $m_h\gsim61\GeV$. The remaining experimentally allowed region in the
five-dimensional parameter space of this light gluino model is severely
fine-tuned (with $\tan\beta=1.88-1.89$ and $m_t=114.0-114.3\GeV$) and
cosmologically troublesome (with a neutralino relic abundance over {\it
five-hundred times larger than allowed}). Modest improvements in sensitivity in
LEP Higgs searches and Tevatron top-quark searches should soon exclude this
theoretically disfavored model completely.
","[{""version"":""v1"",""created"":""Wed, 12 May 1993 17:03:56 GMT""}]","2008-11-26"
"hep-ph/9305255","Paul Langacker0","Paul Langacker","Five Phases of Weak Neutral Current Experiments from the Perspective of
  a Theorist","37 pages, LATEX, 19 figures (not included), hard copy available on
  request, UPR-0553T",,"10.1063/1.45430",,"hep-ph",,"  I give my personal perspective on the past, present, and future of weak
neutral current experiments, emphasizing the experimental inputs; the
theoretical difficulties and inputs; the role of model independent and global
analyses; and the implications at each stage. hep-ph/yymmnnn
","[{""version"":""v1"",""created"":""Wed, 12 May 1993 16:57:21 GMT""}]","2015-06-25"
"hep-ph/9305256",,"Boris Kopeliovich","Hadronization in Nuclear Matter","7 pages + 3 figs (available upon request), report# LPTHE 93-16",,,,"hep-ph",,"  Nuclei are unique analyzers of the space-time development of jets at early
stage. We argue that the gluon bremsstrahlung, rather than the color string, is
the main mechanism of hadronization of highly virtual quarks produced in a hard
interaction. It results in an energy- and time-independent density of energy
loss, like a color string, but steeply dependent on the quark virtuality.
Effects of formation zone (FZ) and color transparency (CT) substantially affect
the jet quenching in a nuclear matter. The latter also plays an important role
in the broadening of transverse momentum distribution of a quark passing a
nucleus. Parameter-free calculations provide a good description of available
data on nuclear effects in the leading hadron production in deep-inelastic
lepton scattering, back-to-back high-$p_T$ hadron pair production, broadening
of the transverse momentum distribution in the Drell-Yan process of lepton pair
production on nuclei.
","[{""version"":""v1"",""created"":""Wed, 12 May 1993 17:08:12 GMT""}]","2007-05-23"
"hep-ph/9305257","Carlo Giunti","S.M. Bilenky and C. Giunti","Towards a Model Independent Treatment of Future Solar Neutrino Data","DFTT 21/93. LaTeX file, 12 pages + 2 figures (included)","Phys.Lett. B311 (1993) 179-186","10.1016/0370-2693(93)90552-S",,"hep-ph",,"  Possibilities of a model independent treatment of the data from future
real-time solar neutrino experiments (SNO, Super-Kamiokande and others) are
discussed. It is shown that in the general case of transitions of the initial
solar $\nu_e$'s into $\nu_\mu$ and/or $\nu_\tau$ the total flux of initial
$^8\mathrm{B}$ neutrinos and the $\nu_e$ survival probability can be determined
directly from the experimental data. Relations between observable quantities
are derived, which, if confronted with the experimental data, would allow to
reveal the presence of sterile neutrinos in the solar neutrino flux on the
earth. Neutrino transitions due to spin and resonant spin-flavour precession in
the magnetic field of the sun are shortly discussed.
","[{""version"":""v1"",""created"":""Wed, 12 May 1993 17:23:06 GMT""}]","2009-10-22"
"hep-ph/9305258","John Terning","Thomas Appelquist and John Terning","Revenge of the One-Family Technicolor Models","16 pages, LaTeX","Phys.Lett. B315 (1993) 139-145","10.1016/0370-2693(93)90171-D",,"hep-ph",,"  We describe how isospin splitting and techniquark-technilepton splitting in
one-family technicolor models can reduce the predicted value of the electroweak
radiative correction parameter S, without making a large contribution to the T
parameter.
","[{""version"":""v1"",""created"":""Wed, 12 May 1993 19:38:31 GMT""}]","2009-10-22"
"hep-ph/9305259",,"R.N. Mohapatra and X. Zhang","Effect of CP-Odd Planck Scale Induced Operators on the Majoron Scale","6 pages, Tex (hep-ph/9305259)","Phys.Rev. D48 (1993) 2935-2936","10.1103/PhysRevD.48.2935",,"hep-ph",,"  Definitions of the control sequences included, but no other changes.
","[{""version"":""v1"",""created"":""Wed, 12 May 1993 21:20:00 GMT""},{""version"":""v2"",""created"":""Fri, 14 May 1993 20:01:00 GMT""}]","2009-10-22"
"hep-ph/9305260","Michael Luke","Adam F. Falk, Michael Luke, Martin J. Savage and Mark B. Wise","Heavy Quark Fragmentation to Polarised Quarkonium","8 pages, 1 figure included, uses harvmac.tex and epsf.tex, UCSD/PTH
  93-06, CALT-68-1864, SLAC-PUB-6175","Phys.Lett. B312 (1993) 486-490","10.1016/0370-2693(93)90986-R",,"hep-ph",,"  We calculate the polarisation of $\psi$'s and $\Upsilon$'s produced by the
fragmentation of heavy quarks. We find that fragmentation to transversely
aligned quarkonium is slightly enhanced relative to longitudinally polarised.
This net alignment corresponds to a $\sim 5\%$ asymmetry in the angular
distribution of leptons produced in the subsequent decay of the quarkonium. We
point out that the leading gluon contribution to $\psi$ and $\Upsilon$
production arises from the evolution of the charm quark fragmentation function,
rather than from direct gluon fragmentation.
","[{""version"":""v1"",""created"":""Wed, 12 May 1993 23:25:35 GMT""},{""version"":""v2"",""created"":""Thu, 13 May 1993 16:49:54 GMT""}]","2009-10-22"
"hep-th/9305051","Boguslaw Broda","Boguslaw Broda (U. Clausthal and U. Lodz)","Chern-Simons theory on an arbitrary manifold via surgery","8 pages",,,,"hep-th math.QA",,"  A general formula for physical observables in Chern-Simons theory with an
arbitrary compact Lie group $G$, on an arbitrary closed oriented
three-dimensional manifold $\cM$ is derived in terms of vacuum expectation
values of Wilson loops in ${\cal S}^3$. Surgery presentation of $\cM$ and the
Kirby moves are implemented as the main ingredients of the approach. The case
of $G={\rm SU}(n)$ is explicitly calculated.
","[{""version"":""v1"",""created"":""Wed, 12 May 1993 16:21:57 GMT""}]","2008-02-03"
"hep-th/9305052","Kumar S. Gupta","K. S. Gupta and S. G. Rajeev","Renormalization in Quantum Mechanics","16 pages, UR-1310, ER-40685-760. (Additional references included.)","Phys.Rev. D48 (1993) 5940-5945","10.1103/PhysRevD.48.5940",,"hep-th hep-lat hep-ph",,"  We implement the concept of Wilson renormalization in the context of simple
quantum mechanical systems. The attractive inverse square potential leads to a
$\b$ function with a nontrivial ultraviolet stable fixed point and the Hulthen
potential exhibits the crossover phenomenon. We also discuss the implementation
of the Wilson scheme in the broader context of one dimensional potential
problems. The possibility of an analogue of Zamolodchikov's $C$ function in
these systems is also discussed.
","[{""version"":""v1"",""created"":""Wed, 12 May 1993 20:56:00 GMT""},{""version"":""v2"",""created"":""Wed, 19 May 1993 21:41:00 GMT""}]","2009-10-22"
"hep-th/9305053","Kanehisa Takasaki","Kanehisa Takasaki","Integrable hierarchy underlying topological Landau-Ginzburg models of
  D-type","14 pages, Kyoto University KUCP-0061/93",,"10.1007/BF00749727",,"hep-th",,"  A universal integrable hierarchy underlying topological Landau-Ginzburg
models of D-tye is presented. Like the dispersionless Toda hierarchy, the new
hierarchy has two distinct (``positive"" and ``negative"") set of flows. Special
solutions corresponding to topological Landau-Ginzburg models of D-type are
characterized by a Riemann-Hilbert problem, which can be converted into a
generalized hodograph transformation. This construction gives an embedding of
the finite dimensional small phase space of these models into the full space of
flows of this hierarchy. One of flat coordinates in the small phase space turns
out to be identical to the first ``negative"" time variable of the hierarchy,
whereas the others belong to the ``positive"" flows.
","[{""version"":""v1"",""created"":""Thu, 13 May 1993 06:33:35 GMT""}]","2009-10-22"
"hep-th/9305054",,"Arlen Anderson","Canonical Transformations in Quantum Mechanics","43 pages, LaTeX, McGill Univ. 92-29, Imperial-TP-92-93-31,
  NSF-ITP-93-61","Annals Phys. 232 (1994) 292-331","10.1006/aphy.1994.1055",,"hep-th gr-qc",,"  Quantum canonical transformations are defined algebraically outside of a
Hilbert space context. This generalizes the quantum canonical transformations
of Weyl and Dirac to include non-unitary transformations. The importance of
non-unitary transformations for constructing solutions of the Schr\""odinger
equation is discussed. Three elementary canonical transformations are shown
both to have quantum implementations as finite transformations and to generate,
classically and infinitesimally, the full canonical algebra. A general
canonical transformation can be realized quantum mechanically as a product of
these transformations. Each transformation corresponds to a familiar tool used
in solving differential equations, and the procedure of solving a differential
equation is systematized by the use of the canonical transformations. Several
examples are done to illustrate the use of the canonical transformations. [This
is an extensively revised version of hep-th-9205080: the first third of the
paper is new material; the notation has been simplified, and further discussion
has been added to the remainder.]
","[{""version"":""v1"",""created"":""Thu, 13 May 1993 07:21:49 GMT""}]","2009-10-22"
"hep-th/9305055","Quevedo","Fernando Quevedo","Abelian and Non-Abelian Dualities in String Bacgrounds","12 pages, harvmac, 2 figures included. NEIP-003/93",,,,"hep-th",,"  We present a brief discussion of recent work on duality symmetries in
non-trivial string backgrounds. Duality is obtained from a gauged non-linear
sigma-model with vanishing gauge field strength. Standard results are
reproduced for abelian gauge groups, whereas a new type of duality is
identified for non--abelian gauge groups. Examples of duals of WZW models and
4-d black holes are given. (Presented at `From Superstrings to Supergravity',
Erice 1992)
","[{""version"":""v1"",""created"":""Thu, 13 May 1993 09:14:37 GMT""}]","2009-09-25"
"hep-th/9305056","Shimon Levit","Shimon Levit","Body Fixed Frame, Rigid Gauge Rotations and Large N Random Fields in QCD","29 pages LATEX, Weizmann Institute preprint WIS-93/40/Apr -PH","Z.Phys.A353:213-225,1995","10.1007/BF01295900",,"hep-th hep-ph nucl-th",,"  The ""body fixed frame"" with respect to local gauge transformations is
introduced. Rigid gauge ""rotations"" in QCD and their \Sch equation are studied
for static and dynamic quarks. Possible choices of the rigid gauge field
configuration corresponding to a nonvanishing static colormagnetic field in the
""body fixed"" frame are discussed. A gauge invariant variational equation is
derived in this frame. For large number N of colors the rigid gauge field
configuration is regarded as random with maximally random probability
distribution under constraints on macroscopic--like quantities. For the uniform
magnetic field the joint probability distribution of the field components is
determined by maximizing the appropriate entropy under the area law constraint
for the Wilson loop. In the quark sector the gauge invariance requires the
rigid gauge field configuration to appear not only as a background but also as
inducing an instantaneous quark-quark interaction. Both are random in the large
N limit.
","[{""version"":""v1"",""created"":""Thu, 13 May 1993 09:39:19 GMT""}]","2014-11-18"
"hep-th/9305057","Michael P. Tuite","Michael P.Tuite","On the Relationship between the Uniqueness of the Moonshine Module and
  Monstrous Moonshine","53 pages, PlainTex, DIAS-STP-93-09","Commun.Math.Phys.166:495-532,1995","10.1007/BF02099885",,"hep-th",,"  We consider the relationship between the conjectured uniqueness of the
Moonshine Module, ${\cal V}^\natural$, and Monstrous Moonshine, the genus zero
property of the modular invariance group for each Monster group Thompson
series. We first discuss a family of possible $Z_n$ meromorphic orbifold
constructions of ${\cal V}^\natural$ based on automorphisms of the Leech
lattice compactified bosonic string. We reproduce the Thompson series for all
51 non-Fricke classes of the Monster group $M$ together with a new relationship
between the centralisers of these classes and 51 corresponding Conway group
centralisers (generalising a well-known relationship for 5 such classes).
Assuming that ${\cal V}^\natural$ is unique, we then consider meromorphic
orbifoldings of ${\cal V}^\natural$ and show that Monstrous Moonshine holds if
and only if the only meromorphic orbifoldings of ${\cal V}^\natural$ give
${\cal V}^\natural$ itself or the Leech theory. This constraint on the
meromorphic orbifoldings of ${\cal V}^\natural$ therefore relates Monstrous
Moonshine to the uniqueness of ${\cal V}^\natural$ in a new way.
","[{""version"":""v1"",""created"":""Thu, 13 May 1993 12:38:00 GMT""}]","2010-11-01"
